{
  "schema": "lobster-buffet.local-adapter-config.v0.1.0",
  "adapter_api": "lobster-buffet.local-adapter.v0",
  "backend": {
    "kind": "fixture",
    "fixture_path": "synthetic-project-inspect-adapter.v0.1.0.json"
  },
  "private_data": {
    "contains_private_values": false,
    "private_refs_only": true,
    "disclosure_policy": "local_only"
  }
}
